{
  "schema_id": "naturalcontrol.estimation_prediction.v1.1",
  "spec_version": "1.1",
  "epoch_ns": "1742050000001000000",
  "prediction_id": "pred-011",
  "source_observation_id": "obs-011",
  "request_id": "req-click-001",
  "interaction_id": "interaction-blueclicker-001",
  "horizon_ns": "16000000",
  "coordinate_space": {
    "space_kind": "viewport_px",
    "viewport_w": 1920,
    "viewport_h": 1080,
    "dpr": 1
  },
  "subjects": [
    {
      "subject_id": "target-blue-001",
      "confidence": 0.95,
      "representation_kind": "hybrid",
      "geometry_2d": {
        "bbox": {
          "x": 762,
          "y": 180,
          "w": 64,
          "h": 64
        },
        "point": {
          "x": 794,
          "y": 212
        }
      },
      "kinematics_2d": {
        "velocity": {
          "x": 2,
          "y": 0
        }
      },
      "body_keypoints": [
        {
          "name": "head_center",
          "point2d": {
            "x": 794,
            "y": 194
          },
          "confidence": 0.94
        }
      ],
      "uncertainty": {
        "radius_2d": 6,
        "notes": "simple forward prediction"
      },
      "model_ref": "kalman/basic-v1"
    }
  ]
}
